{
  "$schema": "https://json-schema.org/draft/2020-12/schema",
  "$id": "baseball2vector/lm_request_v1",
  "title": "Baseball2Vector local LM request envelope v1",
  "type": "object",
  "properties": {
    "schema_version": {"const": "v1"},
    "record_id": {"type": "string", "minLength": 1},
    "arm": {"enum": ["b", "c", "d"]},
    "prompt": {"type": "string", "minLength": 1},
    "tools": {"type": "array", "minItems": 1}
  },
  "required": ["schema_version", "record_id", "arm", "prompt", "tools"],
  "additionalProperties": false
}
