{
  "schema_version": "v1",
  "record_id": "Nico Hoerner__2024_2025",
  "arm": "b",
  "prompt": "# Arm B — Blind vector reasoning (v1)\n\nYou are predicting an MLB hitter's observed change in value from period t to\nt+1. The subject's identity, team, and calendar seasons are intentionally\nhidden. Do not infer or invent them.\n\nEach tool is on the 20–80 scouting scale (50 is league average; 10 points is\none standard deviation). The delta is an observed vector change, not a\nhypothetical intervention.\n\nAnonymous subject: `player_a4098117`\n\n| Input | Power | Contact | Discipline | Defense | Speed |\n|---|---:|---:|---:|---:|---:|\n| Vector at t | 32.7 | 67.0 | 43.6 | 53.2 | 55.8 |\n| Observed delta | -0.0 | 3.5 | -0.6 | 4.8 | -3.4 |\n\nPredict the accompanying `delta_war`, `delta_wrc`, and `delta_ops` using only\nthese numbers. Do not perform hidden lookups or identify the subject. Submit\nexactly one `submit_prediction` tool call. Set `comparables` to null because\nthis arm has no comparable-search tool. Keep `rationale` brief.\n",
  "tools": [
    {
      "name": "submit_prediction",
      "description": "Submit your final prediction. This is the only way to answer -- always call this exactly once, as your last action.",
      "input_schema": {
        "type": "object",
        "properties": {
          "delta_war": {
            "type": "number"
          },
          "delta_wrc": {
            "type": "number"
          },
          "delta_ops": {
            "type": "number"
          },
          "confidence": {
            "type": "number",
            "minimum": 0,
            "maximum": 1,
            "description": "0-1 confidence in this prediction."
          },
          "comparables": {
            "type": "array",
            "items": {
              "type": "string",
              "pattern": "^.+ \\(\\d{4}\\)$"
            },
            "description": "Comparable player ids, if any were used.",
            "maxItems": 10
          },
          "rationale": {
            "type": "string",
            "description": "Brief explanation of your reasoning and which tool outputs (if any) drove it."
          }
        },
        "required": [
          "delta_war",
          "delta_wrc",
          "delta_ops"
        ]
      }
    }
  ]
}