{
  "schema_version": "v1",
  "record_id": "Bobby Witt Jr.__2024_2025",
  "arm": "d",
  "prompt": "# Arm D — Blind vector reasoning with tools (v1)\n\nYou are predicting an MLB hitter's observed change in value from period t to\nt+1. The subject's identity, team, and calendar seasons are intentionally\nhidden. Do not use tool results to reverse-identify the subject.\n\nEach tool is on the 20–80 scouting scale (50 is league average; 10 points is\none standard deviation). The delta is an observed vector change, not a\nhypothetical intervention.\n\nAnonymous subject: `player_b735d5c2`\n\n| Input | Power | Contact | Discipline | Defense | Speed |\n|---|---:|---:|---:|---:|---:|\n| Vector at t | 59.7 | 66.7 | 41.2 | 59.5 | 52.6 |\n| Observed delta | -5.6 | -7.5 | -2.7 | 6.4 | 5.0 |\n\nAvailable tools:\n\n- `predict_value_delta(delta_vec, base_vec)`: code-computed regression anchor.\n- `check_delta_feasibility(tool, current_value, magnitude)`: empirical delta percentile.\n- `find_comparables(vec5, k)`: nearest historical player-season IDs.\n- `get_player_vector(player_id, season)`: vector for an available historical comparable.\n- `apply_tool_delta(vec5, tool, magnitude)`: code-computed one-tool shift.\n\nUse tools for numeric calculations; do not mentally recreate their arithmetic.\nPredict `delta_war`, `delta_wrc`, and `delta_ops`, then make exactly one final\n`submit_prediction` tool call. If comparables influenced the answer, return at\nmost 10 IDs from `find_comparables`. Briefly identify the tool outputs used in\n`rationale`.\n",
  "tools": [
    {
      "name": "get_player_vector",
      "description": "Look up a real player's 5-tool vector for a specific season. Call this when a comparable name from find_comparables is worth inspecting directly, or to compare a hypothetical vector against a known real player.",
      "input_schema": {
        "type": "object",
        "properties": {
          "player_id": {
            "type": "string",
            "description": "Player name, e.g. 'Juan Soto'."
          },
          "season": {
            "type": "integer",
            "description": "Season year, e.g. 2023."
          }
        },
        "required": [
          "player_id",
          "season"
        ]
      }
    },
    {
      "name": "apply_tool_delta",
      "description": "Shift one tool in a 5-tool vector by a magnitude, returning the resulting vector. Use this to construct a hypothetical comparison point rather than adding the numbers yourself.",
      "input_schema": {
        "type": "object",
        "properties": {
          "vec5": {
            "type": "object",
            "description": "The base 5-tool vector.",
            "properties": {
              "Power": {
                "type": "number"
              },
              "Contact": {
                "type": "number"
              },
              "Discipline": {
                "type": "number"
              },
              "Defense": {
                "type": "number"
              },
              "Speed": {
                "type": "number"
              }
            },
            "required": [
              "Power",
              "Contact",
              "Discipline",
              "Defense",
              "Speed"
            ]
          },
          "tool": {
            "type": "string",
            "enum": [
              "Power",
              "Contact",
              "Discipline",
              "Defense",
              "Speed"
            ],
            "description": "Which tool to shift."
          },
          "magnitude": {
            "type": "number",
            "description": "Amount to add (can be negative)."
          }
        },
        "required": [
          "vec5",
          "tool",
          "magnitude"
        ]
      }
    },
    {
      "name": "predict_value_delta",
      "description": "Run the project's fitted regression model (delta-tool features + season-t base level + interaction terms) to get a numeric point estimate for delta WAR, delta wRC+, and delta OPS. Call this before finalizing your prediction -- it is your numeric anchor, computed by code, not a suggestion to estimate yourself.",
      "input_schema": {
        "type": "object",
        "properties": {
          "delta_vec": {
            "type": "object",
            "description": "The observed delta vector (season t -> t+1).",
            "properties": {
              "Power": {
                "type": "number"
              },
              "Contact": {
                "type": "number"
              },
              "Discipline": {
                "type": "number"
              },
              "Defense": {
                "type": "number"
              },
              "Speed": {
                "type": "number"
              }
            },
            "required": [
              "Power",
              "Contact",
              "Discipline",
              "Defense",
              "Speed"
            ]
          },
          "base_vec": {
            "type": "object",
            "description": "The season-t vector.",
            "properties": {
              "Power": {
                "type": "number"
              },
              "Contact": {
                "type": "number"
              },
              "Discipline": {
                "type": "number"
              },
              "Defense": {
                "type": "number"
              },
              "Speed": {
                "type": "number"
              }
            },
            "required": [
              "Power",
              "Contact",
              "Discipline",
              "Defense",
              "Speed"
            ]
          }
        },
        "required": [
          "delta_vec",
          "base_vec"
        ]
      }
    },
    {
      "name": "find_comparables",
      "description": "Find the k real players (by name and season) whose season-t vector is nearest to a given 5-tool vector. Returns real identities even when your own subject is anonymized -- use it to reason about comparable profiles, not to guess who your subject is.",
      "input_schema": {
        "type": "object",
        "properties": {
          "vec5": {
            "type": "object",
            "description": "Query vector.",
            "properties": {
              "Power": {
                "type": "number"
              },
              "Contact": {
                "type": "number"
              },
              "Discipline": {
                "type": "number"
              },
              "Defense": {
                "type": "number"
              },
              "Speed": {
                "type": "number"
              }
            },
            "required": [
              "Power",
              "Contact",
              "Discipline",
              "Defense",
              "Speed"
            ]
          },
          "k": {
            "type": "integer",
            "minimum": 1,
            "maximum": 10,
            "description": "Number of neighbors, default 10.",
            "default": 10
          }
        },
        "required": [
          "vec5"
        ]
      }
    },
    {
      "name": "check_delta_feasibility",
      "description": "Return the empirical percentile of a delta-tool magnitude among real observed transitions starting from a similar current value. Call this to judge whether an observed or hypothetical delta is typical or extreme for a player at that starting level -- e.g. whether pushing an already-elite tool further is something that actually happens in the data.",
      "input_schema": {
        "type": "object",
        "properties": {
          "tool": {
            "type": "string",
            "enum": [
              "Power",
              "Contact",
              "Discipline",
              "Defense",
              "Speed"
            ]
          },
          "current_value": {
            "type": "number",
            "description": "Season-t tool value (20-80 scale)."
          },
          "magnitude": {
            "type": "number",
            "description": "The delta magnitude to evaluate."
          }
        },
        "required": [
          "tool",
          "current_value",
          "magnitude"
        ]
      }
    },
    {
      "name": "submit_prediction",
      "description": "Submit your final prediction. This is the only way to answer -- always call this exactly once, as your last action.",
      "input_schema": {
        "type": "object",
        "properties": {
          "delta_war": {
            "type": "number"
          },
          "delta_wrc": {
            "type": "number"
          },
          "delta_ops": {
            "type": "number"
          },
          "confidence": {
            "type": "number",
            "minimum": 0,
            "maximum": 1,
            "description": "0-1 confidence in this prediction."
          },
          "comparables": {
            "type": "array",
            "items": {
              "type": "string"
            },
            "description": "Comparable player ids, if any were used.",
            "maxItems": 10
          },
          "rationale": {
            "type": "string",
            "description": "Brief explanation of your reasoning and which tool outputs (if any) drove it."
          }
        },
        "required": [
          "delta_war",
          "delta_wrc",
          "delta_ops"
        ]
      }
    }
  ]
}