{
  "schema_version": "v1",
  "record_id": "Zach Neto__2024_2025",
  "arm": "c",
  "prompt": "# Arm C — Named player reasoning (v2)\n\nYou are predicting an MLB hitter's observed change in value from one named\nseason to the next. This arm intentionally exposes identity and seasons so its\nperformance can measure the contribution of text knowledge or memorization.\n\nEach tool is on the 20–80 scouting scale (50 is league average; 10 points is\none standard deviation). The delta is an observed vector change, not a\nhypothetical intervention.\n\nPlayer: **Zach Neto**  \nTransition: **2024 → 2025**\n\n| Input | Power | Contact | Discipline | Defense | Speed |\n|---|---:|---:|---:|---:|---:|\n| Vector in 2024 | 46.1 | 48.7 | 38.1 | 42.9 | 45.8 |\n| Observed delta | 5.2 | -1.1 | -0.6 | -3.3 | 2.3 |\n\nPredict the accompanying `delta_war`, `delta_wrc`, and `delta_ops`. You may use\nknowledge associated with the named player and seasons, but do not fabricate\nfacts when uncertain. Submit exactly one `submit_prediction` tool call. Keep\nSet `comparables` to null unless you can provide specific historical player-season IDs in exact `Name (YYYY)` format. Never place archetype descriptions in `comparables`.\n`rationale` brief and state whether player-specific knowledge affected it.\n",
  "tools": [
    {
      "name": "submit_prediction",
      "description": "Submit your final prediction. This is the only way to answer -- always call this exactly once, as your last action.",
      "input_schema": {
        "type": "object",
        "properties": {
          "delta_war": {
            "type": "number"
          },
          "delta_wrc": {
            "type": "number"
          },
          "delta_ops": {
            "type": "number"
          },
          "confidence": {
            "type": "number",
            "minimum": 0,
            "maximum": 1,
            "description": "0-1 confidence in this prediction."
          },
          "comparables": {
            "type": "array",
            "items": {
              "type": "string",
              "pattern": "^.+ \\(\\d{4}\\)$"
            },
            "description": "Comparable player ids, if any were used.",
            "maxItems": 10
          },
          "rationale": {
            "type": "string",
            "description": "Brief explanation of your reasoning and which tool outputs (if any) drove it."
          }
        },
        "required": [
          "delta_war",
          "delta_wrc",
          "delta_ops"
        ]
      }
    }
  ]
}